{
  "$schema": "https://json-schema.org/draft/2020-12/schema",
  "$id": "https://schemas.harness.invalid/config.clock.schema.json",
  "title": "drogna clock configuration",
  "description": "Configuration for C-01, the simulation clock. It carries the common sections like every other component, and adds the run's clock itself: the simulation epoch and tick interval from which every tick value follows, the mode and rate the run starts in, the bounds a rate request from the browser is checked against, and where the run manifest is written. Note which section says what. The common clock section describes the interface this service publishes — the endpoint and routes its clients are configured to reach — while the clock_service section below is the clock it serves; where the two name a mode, the clock_service one is authoritative because this component sets the mode rather than expecting it.",
  "type": "object",
  "required": ["component", "clock", "seed", "logging", "clock_service"],
  "additionalProperties": false,
  "properties": {
    "component": { "$ref": "https://schemas.harness.invalid/config.common.schema.json#/$defs/component" },
    "clock": { "$ref": "https://schemas.harness.invalid/config.common.schema.json#/$defs/clock" },
    "seed": { "$ref": "https://schemas.harness.invalid/config.common.schema.json#/$defs/seed" },
    "broker": { "$ref": "https://schemas.harness.invalid/config.common.schema.json#/$defs/broker" },
    "logging": { "$ref": "https://schemas.harness.invalid/config.common.schema.json#/$defs/logging" },
    "clock_service": {
      "title": "The clock this service serves",
      "description": "Named clock_service rather than clock because the common clock section already holds that name and means the opposite thing: how a component reaches the clock, not how the clock runs.",
      "type": "object",
      "required": [
        "bind",
        "epoch",
        "tick_interval_us",
        "default_mode",
        "default_rate",
        "rate_bounds",
        "idle_poll_seconds",
        "liveness_window_seconds",
        "run",
        "manifest"
      ],
      "additionalProperties": false,
      "properties": {
        "bind": {
          "title": "Listening address",
          "description": "Where the HTTP interface listens. Distinct from the common clock section's endpoint, which is where clients reach it: inside a container network the two differ, and pretending otherwise would put a deployment topology in source.",
          "type": "object",
          "required": ["host", "port"],
          "additionalProperties": false,
          "properties": {
            "host": { "type": "string", "description": "Interface to bind." },
            "port": {
              "type": "integer",
              "minimum": 1,
              "maximum": 65535,
              "description": "Port to bind."
            }
          }
        },
        "epoch": {
          "type": "string",
          "description": "The run's simulation epoch, ISO-8601 UTC with microsecond precision. Tick n is epoch + n * tick_interval_us, so this value and the next one fix every tick value in the run."
        },
        "tick_interval_us": {
          "type": "integer",
          "exclusiveMinimum": 0,
          "description": "Simulation microseconds between ticks, in exact integers. A rate change alters how quickly ticks are emitted and never what they say."
        },
        "default_mode": {
          "$ref": "https://schemas.harness.invalid/config.common.schema.json#/$defs/clock_mode",
          "description": "The mode the run starts in. Byte-identical replay is claimed for lockstep only."
        },
        "default_rate": {
          "type": "number",
          "minimum": 0,
          "description": "The rate the run starts at. Zero starts the clock pinned, which is legitimate: it stops simulated time and stops nothing else (ADR-0006, FR-53)."
        },
        "rate_bounds": {
          "title": "Permitted rates",
          "description": "What a rate request from the browser is checked against. A request outside these is refused with a readable error and the current state is unchanged.",
          "type": "object",
          "required": ["minimum", "maximum"],
          "additionalProperties": false,
          "properties": {
            "minimum": {
              "type": "number",
              "minimum": 0,
              "description": "Least permitted rate. Zero, so that a capture can pin the clock."
            },
            "maximum": { "type": "number", "minimum": 0, "description": "Greatest permitted rate." }
          }
        },
        "lockstep_deadline_seconds": {
          "type": "number",
          "exclusiveMinimum": 0,
          "description": "Host seconds the lockstep barrier waits for an outstanding acknowledgement before the stall is reported. It never skips the tick: a participant that dies stalls the clock rather than being outrun, which is the correct failure for a replay mode (ADR-0009)."
        },
        "idle_poll_seconds": {
          "type": "number",
          "exclusiveMinimum": 0,
          "description": "How long the service waits between attempts when nothing is due — pinned, paused, or held at the lockstep barrier. Host seconds, because it is a poll interval and not a measurement of anything; the heartbeat still goes out on its own real-time cadence while the clock is held."
        },
        "liveness_window_seconds": {
          "type": "number",
          "exclusiveMinimum": 0,
          "description": "How long, in host seconds, one of this component's heartbeats should be taken as evidence that it is alive. Published in the heartbeat itself, because only the sender knows its own cadence and the receiver holds no table of expected intervals (ADR-0006)."
        },
        "run": {
          "title": "Run identity",
          "description": "Who this run is and what code it is running. The clock holds the run's identity because it is the component that must exist before any other.",
          "type": "object",
          "required": ["id", "code_revision"],
          "additionalProperties": false,
          "properties": {
            "id": {
              "type": "string",
              "pattern": "^[a-z0-9][a-z0-9_-]*$",
              "description": "The run id, recorded in the manifest and carried on every tick. Deterministic: it comes from here, never from entropy or a host clock. A resumed run takes its id from the manifest instead."
            },
            "code_revision": {
              "type": "string",
              "description": "Commit identifier, or a build identifier where there is no commit. A replay claims byte-identical output only against the same revision."
            },
            "code_dirty": {
              "type": "boolean",
              "description": "True when the code was run from a working tree, in which case the revision does not identify it and the replay claim does not hold."
            }
          }
        },
        "manifest": {
          "title": "Run manifest",
          "description": "Where the run manifest is written. If a manifest is already there when the service starts, the run is resumed from it rather than restarted: a clock that silently rewound time would be worse than one that refused to start.",
          "type": "object",
          "required": ["directory", "file"],
          "additionalProperties": false,
          "properties": {
            "directory": { "type": "string", "description": "Directory holding the manifest." },
            "file": { "type": "string", "description": "File name of the manifest within it." }
          }
        }
      }
    }
  }
}
